{
  "id": "be.fluvius-kempen.household",
  "name": "Fluvius Kempen – capaciteitstarief",
  "country": "BE",
  "operator": "Fluvius Kempen",
  "currency": "EUR",
  "tz": "Europe/Brussels",
  "source_url": "https://assets.vlaamsenutsregulator.be/2025-11/FK%20-%202026%20-%20ELEK.pdf?VersionId=_XBAUFwbzt3jXZ5fEsWqyfEaVIHV0AW.",
  "verified": "2026-08-24",
  "versions": [
    {
      "valid_from": "2026-01-01",
      "verified": "2026-08-24",
      "source_url": "https://assets.vlaamsenutsregulator.be/2025-11/FK%20-%202026%20-%20ELEK.pdf?VersionId=_XBAUFwbzt3jXZ5fEsWqyfEaVIHV0AW.",
      "peak": {
        "window_min": 15,
        "per_day": "all",
        "per_period": "max",
        "n": 1,
        "period": "rolling_months",
        "rolling_months": 12,
        "price_period_unit": "year",
        "pricing": {
          "linear": {
            "price_per_kw": 56.2069857,
            "min_kw": 2.5
          }
        }
      }
    }
  ]
}
