{
  "id": "be.fluvius-west.household",
  "name": "Fluvius West – capaciteitstarief",
  "country": "BE",
  "operator": "Fluvius West",
  "currency": "EUR",
  "tz": "Europe/Brussels",
  "source_url": "https://assets.vlaamsenutsregulator.be/2025-11/FW%20-%202026%20-%20ELEK.pdf?VersionId=qqbQm1gDRlAOz7vWkdOLPGESKq4ASvxw",
  "verified": "2026-09-06",
  "versions": [
    {
      "valid_from": "2026-01-01",
      "verified": "2026-09-06",
      "source_url": "https://assets.vlaamsenutsregulator.be/2025-11/FW%20-%202026%20-%20ELEK.pdf?VersionId=qqbQm1gDRlAOz7vWkdOLPGESKq4ASvxw",
      "peak": {
        "window_min": 15,
        "per_day": "all",
        "per_period": "max",
        "n": 1,
        "period": "rolling_months",
        "rolling_months": 12,
        "price_period_unit": "year",
        "pricing": {
          "linear": {
            "price_per_kw": 57.0995726,
            "min_kw": 2.5
          }
        }
      }
    }
  ]
}
