{
  "id": "be.fluvius-zenne-dijle.household",
  "name": "Fluvius Zenne-Dijle – capaciteitstarief",
  "country": "BE",
  "operator": "Fluvius Zenne-Dijle",
  "currency": "EUR",
  "tz": "Europe/Brussels",
  "source_url": "https://assets.vlaamsenutsregulator.be/2025-11/FZD%20-%202026%20-%20ELEK.pdf?VersionId=53MPAG7IanNZ1MVs6cwNO2bm2HLQHodC",
  "verified": "2026-09-10",
  "versions": [
    {
      "valid_from": "2026-01-01",
      "verified": "2026-09-10",
      "source_url": "https://assets.vlaamsenutsregulator.be/2025-11/FZD%20-%202026%20-%20ELEK.pdf?VersionId=53MPAG7IanNZ1MVs6cwNO2bm2HLQHodC",
      "peak": {
        "window_min": 15,
        "per_day": "all",
        "per_period": "max",
        "n": 1,
        "period": "rolling_months",
        "rolling_months": 12,
        "price_period_unit": "year",
        "pricing": {
          "linear": {
            "price_per_kw": 56.1228635,
            "min_kw": 2.5
          }
        }
      }
    }
  ]
}
