{
  "id": "be.fluvius-halle-vilvoorde.household",
  "name": "Fluvius Halle-Vilvoorde – capaciteitstarief",
  "country": "BE",
  "operator": "Fluvius Halle-Vilvoorde",
  "currency": "EUR",
  "tz": "Europe/Brussels",
  "source_url": "https://assets.vlaamsenutsregulator.be/2025-11/FHV%20-%202026%20-%20ELEK.pdf?VersionId=Y9_VcUpkGm6AJg3cL4pdkbIcvC_uDhMY",
  "verified": "2026-09-10",
  "versions": [
    {
      "valid_from": "2026-01-01",
      "verified": "2026-09-10",
      "source_url": "https://assets.vlaamsenutsregulator.be/2025-11/FHV%20-%202026%20-%20ELEK.pdf?VersionId=Y9_VcUpkGm6AJg3cL4pdkbIcvC_uDhMY",
      "peak": {
        "window_min": 15,
        "per_day": "all",
        "per_period": "max",
        "n": 1,
        "period": "rolling_months",
        "rolling_months": 12,
        "price_period_unit": "year",
        "pricing": {
          "linear": {
            "price_per_kw": 56.0428955,
            "min_kw": 2.5
          }
        }
      }
    }
  ]
}
