{
  "id": "se.ellevio.household",
  "name": "Ellevio – privatkund (säkringsabonnemang)",
  "country": "SE",
  "operator": "Ellevio",
  "currency": "SEK",
  "tz": "Europe/Stockholm",
  "source_url": "https://www.ellevio.se/abonnemang/prismodell-utan-effektavgift/",
  "verified": "2026-09-06",
  "versions": [
    {
      "valid_from": "2026-06-01",
      "verified": "2026-09-06",
      "source_url": "https://www.ellevio.se/abonnemang/prismodell-utan-effektavgift/",
      "no_peak": true
    }
  ]
}
