{
  "id": "be.fluvius-antwerpen.household",
  "name": "Fluvius Antwerpen – capaciteitstarief",
  "country": "BE",
  "operator": "Fluvius Antwerpen",
  "currency": "EUR",
  "tz": "Europe/Brussels",
  "source_url": "https://assets.vlaamsenutsregulator.be/2025-11/FA%20-%202026%20-%20ELEK.pdf?VersionId=YY4DDKt6Egvr35pgFTPR_.n99M304GNJ",
  "verified": "2026-08-24",
  "versions": [
    {
      "valid_from": "2026-01-01",
      "verified": "2026-08-24",
      "source_url": "https://assets.vlaamsenutsregulator.be/2025-11/FA%20-%202026%20-%20ELEK.pdf?VersionId=YY4DDKt6Egvr35pgFTPR_.n99M304GNJ",
      "peak": {
        "window_min": 15,
        "per_day": "all",
        "per_period": "max",
        "n": 1,
        "period": "rolling_months",
        "rolling_months": 12,
        "price_period_unit": "year",
        "pricing": {
          "linear": {
            "price_per_kw": 49.4036563,
            "min_kw": 2.5
          }
        }
      }
    }
  ]
}
