{
  "id": "be.fluvius-midden-vlaanderen.household",
  "name": "Fluvius Midden-Vlaanderen – capaciteitstarief",
  "country": "BE",
  "operator": "Fluvius Midden-Vlaanderen",
  "currency": "EUR",
  "tz": "Europe/Brussels",
  "source_url": "https://assets.vlaamsenutsregulator.be/2025-11/FMV%20-%202026%20-%20ELEK.pdf?VersionId=UYYfwMo_I7mx2UvKZvdMPz1ab9cGcYLy",
  "verified": "2026-09-06",
  "versions": [
    {
      "valid_from": "2026-01-01",
      "verified": "2026-09-06",
      "source_url": "https://assets.vlaamsenutsregulator.be/2025-11/FMV%20-%202026%20-%20ELEK.pdf?VersionId=UYYfwMo_I7mx2UvKZvdMPz1ab9cGcYLy",
      "peak": {
        "window_min": 15,
        "per_day": "all",
        "per_period": "max",
        "n": 1,
        "period": "rolling_months",
        "rolling_months": 12,
        "price_period_unit": "year",
        "pricing": {
          "linear": {
            "price_per_kw": 50.1239818,
            "min_kw": 2.5
          }
        }
      }
    }
  ]
}
