{
  "id": "no.generic-top3",
  "name": "Norway – generic capacity steps (DSO not listed)",
  "country": "NO",
  "currency": "NOK",
  "tz": "Europe/Oslo",
  "source_url": "https://lovdata.no/dokument/SF/forskrift/1999-03-11-302",
  "verified": null,
  "assumed": "The grammar is national and mandated — every Norwegian DSO has billed a monthly capacity fee in steps, set by the average of the three highest hours on three different days, since 2022-07-01 (forskrift om nettregulering, kap. 14; HLD §8). The step boundaries 2/5/10/15/20 kW are close to universal, but the fees are per DSO: the ones here are Tensio's 2026-01-01 household table used as a representative national one. A site whose DSO is listed should pick that preset instead; a site using this one gets the right behaviour and an approximate bill.",
  "versions": [
    {
      "valid_from": "2026-01-01",
      "verified": null,
      "assumed": "See the file-level note: national grammar, representative fees.",
      "peak": {
        "window_min": 60,
        "per_day": "max",
        "per_period": "mean_top_n",
        "n": 3,
        "distinct_days": true,
        "period": "month",
        "pricing": {
          "steps": [
            [2, 137, "0–2 kW"],
            [5, 244, "2–5 kW"],
            [10, 416, "5–10 kW"],
            [15, 613, "10–15 kW"],
            [20, 812, "15–20 kW"],
            [null, 1200, "over 20 kW"]
          ]
        }
      }
    }
  ]
}
